{
  "parcel_id": "parcel_001",
  "updated_at": "2026-04-03T18:20:00Z",
  "observed_at": "2026-04-03T18:15:00Z",
  "indoor_air": {
    "pm25_ugm3": 18.4,
    "temperature_c": 24.2,
    "relative_humidity_pct": 42.1
  },
  "hvac_state": {
    "mode": "cool",
    "fan_mode": "on",
    "air_mode": "recirculate",
    "filter_condition": "ok"
  },
  "device_state": {
    "purifier_state": "on",
    "backup_power_state": "standby",
    "window_state": "closed",
    "shade_state": "partial",
    "sump_state": "unknown"
  }
}
